"Einschließlich Transaktionen zu Amazon Marketplace, Versand durch Amazon und Amazon Webstore",,,,,,,,,,,,,,,,,,,,,,,,,,
Alle Beträge in Euro sofern nicht anders gekennzeichnet,,,,,,,,,,,,,,,,,,,,,,,,,,
Definitionen:,,,,,,,,,,,,,,,,,,,,,,,,,,
"Eingezogene Umsatzsteuer: Einschließlich von Käufern eingezogene Umsatzsteuer für Produktverkäufe, Versand und Geschenkverpackung.",,,,,,,,,,,,,,,,,,,,,,,,,,
Verkaufsgebühren: Beinhaltet variable Abschlussgebühren und Werbekostenerstattungen.,,,,,,,,,,,,,,,,,,,,,,,,,,
Andere Transaktionsgebühren: Einschließlich Ausgleichsbuchungen für Versand und Versandgebühren.,,,,,,,,,,,,,,,,,,,,,,,,,,
"Andere: Enthält Beträge zu Transaktionen, die nicht auf eine Bestellung bezogen sind. Weitere Details finden Sie zu jeder Bestellung in den Spalten ""Typ"" und ""Beschreibung"".",,,,,,,,,,,,,,,,,,,,,,,,,,
Datum/Uhrzeit,Abrechnungsnummer,Typ,Bestellnummer,SKU,Beschreibung,Menge,Marketplace,Versand,Ort der Bestellung,Bundesland,Postleitzahl,Steuererhebungsmodell,Umsätze,Produktumsatzsteuer,Gutschrift für Versandkosten,Steuer auf Versandgutschrift,Gutschrift für Geschenkverpackung,Steuer auf Geschenkverpackungsgutschriften,Rabatte aus Werbeaktionen,Steuer auf Aktionsrabatte,Einbehaltene Steuer auf Marketplace,Verkaufsgebühren,Gebühren zu Versand durch Amazon,Andere Transaktionsgebühren,Andere,Gesamt
08.07.2024 09:33:27 UTC,22468837292,Versand durch Amazon Lagergebühr,,,Versand durch Amazon Lagergebühr,,Amazon.de,,,,,,0,0,0,0,0,0,0,0,0,0,0,0,"-0,44","-0,44"
