"Incluye transacciones del Marketplace de Amazon, Logística de Amazon y Amazon Webstore"
"Todos los importes en EUR, a menos que se especifique lo contrario"
"Definiciones:"
"Recaudación de impuestos sobre ventas: incluye los impuestos sobre ventas recaudados al comprador respecto al producto, el envío y el envoltorio para regalo."
"Tarifas por venta: incluyen tarifas variables por cierre de venta y tarifas por referencia."
"Tarifas de otras transacciones: incluye reintegros de los cargos por envío, retenciones de envío y tarifas de impuestos sobre ventas."
"Otro: incluye importes de transacciones distintas del pedido. Para mas información, consulta las columnas ""Tipo"" y ""Descripción"" de cada número de pedido."
"fecha y hora","identificador de pago","tipo","número de pedido","sku","descripción","cantidad","web de Amazon","gestión logística","ciudad de procedencia del pedido","comunidad autónoma de procedencia del pedido","código postal de procedencia del pedido","Formulario de recaudación de impuestos","ventas de productos","impuesto de ventas de productos","abonos de envío","impuestos por abonos de envío","abonos de envoltorio para regalo","giftwrap credits tax","devoluciones promocionales","promotional rebates tax","impuesto retenido en el sitio web","tarifas de venta","tarifas de Logística de Amazon","tarifas de otras transacciones","otro","total"
"24 oct 2023 0:33:57 UTC","13223384402","Pedido","405-6430667-0973934","EN-HCWK-7IDG","Trampas para ratones con tapa de cubo deslizante, atrapador de ratas humanas, estilo de puerta de reinicio automático, trampas reutilizables para rat","1","amazon.es","Amazon","Benifallet","Spain","43512","MarketplaceFacilitator","30,17","6,34","0","0","0","0","0","0","-6,34","-5,64","-7,58","0","0","16,95"
"31 oct 2023 14:54:31 UTC","13223384422","Pedido","406-2144434-3973146","EN-HCWK-7IDG","Trampas para ratones con tapa de cubo deslizante, atrapador de ratas humanas, estilo de puerta de reinicio automático, trampas reutilizables para rat","2","amazon.es","Amazon","Olot","Girona","17800","MarketplaceFacilitator","60,18","12,64","1,65","0,34","0","0","0","0","-12,98","-11,26","-16,82","0","0","33,75"
